{
  "operation_id": "22222222-2222-4222-8222-222222222222",
  "status": "denied",
  "decision": {
    "effect": "deny",
    "policy_id": "team_budget",
    "policy_version": "f72bfbef3d3570fe5ad6be5c8c17de3e0c9c159c07dba45a7e3f47bb5f37c664",
    "rule_id": "daily_team_budget",
    "reason": "the transfer would exceed the certified 24-hour team budget",
    "evaluated_policies": [
      {
        "policy_id": "team_budget",
        "policy_version": "f72bfbef3d3570fe5ad6be5c8c17de3e0c9c159c07dba45a7e3f47bb5f37c664"
      }
    ]
  },
  "payload": {},
  "audit_ref": "/v1/audit/22222222-2222-4222-8222-222222222222",
  "replayed": false
}
